"No.","Time","Source","Destination","Protocol","Length","Info"
"2","0.000424","192.168.1.2","192.168.1.3","TCP","66","xmpp-client > 60252 [ACK] Seq=1 Ack=198 Win=32817 Len=0 TSval=1042560 TSecr=109680319"
"3","0.002584","192.168.1.2","192.168.1.4","TCP","253","[TCP segment of a reassembled PDU]"
"9","0.398084","192.168.1.2","192.168.1.4","TCP","60","xmpp-client > 51952 [ACK] Seq=200 Ack=231 Win=15876 Len=0"
"10","0.400774","192.168.1.2","192.168.1.3","TCP","343","[TCP segment of a reassembled PDU]"
"16","2.562015","192.168.1.2","192.168.1.3","TCP","66","xmpp-client > 60252 [ACK] Seq=278 Ack=411 Win=32817 Len=0 TSval=1043200 TSecr=109682876"
"18","2.562335","192.168.1.2","192.168.1.3","TCP","66","xmpp-client > 60252 [ACK] Seq=278 Ack=608 Win=32817 Len=0 TSval=1043200 TSecr=109682876"
"19","2.564373","192.168.1.2","192.168.1.4","TCP","274","[TCP segment of a reassembled PDU]"
"23","2.629076","192.168.1.2","192.168.1.4","TCP","253","[TCP segment of a reassembled PDU]"
"29","3.834539","192.168.1.2","192.168.1.4","TCP","60","xmpp-client > 51952 [ACK] Seq=619 Ack=461 Win=16144 Len=0"
"30","3.836801","192.168.1.2","192.168.1.3","TCP","343","[TCP segment of a reassembled PDU]"
"34","5.064307","192.168.1.2","192.168.1.3","TCP","66","xmpp-client > 60252 [ACK] Seq=555 Ack=805 Win=32817 Len=0 TSval=1043826 TSecr=109685376"
"35","5.066439","192.168.1.2","192.168.1.4","TCP","256","[TCP segment of a reassembled PDU]"
"40","5.583764","192.168.1.2","192.168.1.3","TCP","66","xmpp-client > 60252 [ACK] Seq=555 Ack=1018 Win=32817 Len=0 TSval=1043956 TSecr=109685894"
"42","5.584216","192.168.1.2","192.168.1.3","TCP","66","xmpp-client > 60252 [ACK] Seq=555 Ack=1215 Win=32817 Len=0 TSval=1043956 TSecr=109685894"
"43","5.586126","192.168.1.2","192.168.1.4","TCP","271","[TCP segment of a reassembled PDU]"
"47","5.652465","192.168.1.2","192.168.1.4","TCP","253","[TCP segment of a reassembled PDU]"
