"No.","Time","Source","Destination","Protocol","Length","Info"
"7","2.912451000","192.168.1.6","192.168.1.4","TCP","60","xmpp-client > 57494 [ACK] Seq=1 Ack=206 Win=14000 Len=0"
"8","2.915469000","192.168.1.6","192.168.1.3","TCP","311","[TCP segment of a reassembled PDU]"
"49","6.188630000","192.168.1.6","192.168.1.7","TCP","66","xmpp-client > 57590 [ACK] Seq=1 Ack=196 Win=14476 Len=0 TSval=343814 TSecr=775354"
"50","6.191222000","192.168.1.6","192.168.1.4","TCP","249","[TCP segment of a reassembled PDU]"
"57","6.759432000","192.168.1.6","192.168.1.7","TCP","66","xmpp-client > 57590 [ACK] Seq=1 Ack=391 Win=14744 Len=0 TSval=343957 TSecr=775497"
"58","6.761629000","192.168.1.6","192.168.1.4","TCP","249","[TCP segment of a reassembled PDU]"
"69","8.244219000","192.168.1.6","192.168.1.4","TCP","60","xmpp-client > 57494 [ACK] Seq=391 Ack=330 Win=14000 Len=0"
"70","8.246135000","192.168.1.6","192.168.1.7","TCP","217","[TCP segment of a reassembled PDU]"
"84","10.871138000","192.168.1.6","192.168.1.4","TCP","256","[TCP segment of a reassembled PDU]"
"86","10.906588000","192.168.1.6","192.168.1.3","TCP","66","xmpp-client > 49943 [ACK] Seq=246 Ack=198 Win=32817 Len=0 TSval=344994 TSecr=502581142"
"90","11.362615000","192.168.1.6","192.168.1.3","TCP","66","xmpp-client > 49943 [ACK] Seq=246 Ack=411 Win=32817 Len=0 TSval=345108 TSecr=502581634"
"92","11.362875000","192.168.1.6","192.168.1.3","TCP","66","xmpp-client > 49943 [ACK] Seq=246 Ack=608 Win=32817 Len=0 TSval=345108 TSecr=502581634"
"93","11.364821000","192.168.1.6","192.168.1.4","TCP","268","[TCP segment of a reassembled PDU]"
"97","11.429741000","192.168.1.6","192.168.1.4","TCP","253","[TCP segment of a reassembled PDU]"
"131","14.154525000","192.168.1.6","192.168.1.7","TCP","66","xmpp-client > 57590 [ACK] Seq=152 Ack=588 Win=15012 Len=0 TSval=345805 TSecr=777344"
"132","14.156716000","192.168.1.6","192.168.1.3","TCP","311","[TCP segment of a reassembled PDU]"
