"No.","Time","Source","Destination","Protocol","Length","Info"
"7","3.535238","192.168.1.3","192.168.1.4","TCP","60","xmpp-client > 63822 [ACK] Seq=1 Ack=23 Win=14000 Len=0"
"12","4.176762","192.168.1.3","192.168.1.4","TCP","256","[TCP segment of a reassembled PDU]"
"14","4.214300","192.168.1.3","192.168.1.2","TCP","66","xmpp-client > 54845 [ACK] Seq=1 Ack=198 Win=32817 Len=0 TSval=844128 TSecr=1077700386"
"18","5.276768","192.168.1.3","192.168.1.2","TCP","66","xmpp-client > 54845 [ACK] Seq=1 Ack=411 Win=32817 Len=0 TSval=844393 TSecr=1077701483"
"20","5.277031","192.168.1.3","192.168.1.2","TCP","66","xmpp-client > 54845 [ACK] Seq=1 Ack=608 Win=32817 Len=0 TSval=844393 TSecr=1077701483"
"21","5.279054","192.168.1.3","192.168.1.4","TCP","272","[TCP segment of a reassembled PDU]"
"25","5.346358","192.168.1.3","192.168.1.4","TCP","253","[TCP segment of a reassembled PDU]"
"28","5.361752","192.168.1.3","192.168.1.2","TCP","66","xmpp-client > 54845 [ACK] Seq=1 Ack=805 Win=32817 Len=0 TSval=844414 TSecr=1077701567"
"31","5.407631","192.168.1.3","192.168.1.4","TCP","256","[TCP segment of a reassembled PDU]"
"78","8.411886","192.168.1.3","192.168.1.2","TCP","66","xmpp-client > 54845 [ACK] Seq=1 Ack=1002 Win=32817 Len=0 TSval=845177 TSecr=1077704613"
"79","8.413996","192.168.1.3","192.168.1.4","TCP","253","[TCP segment of a reassembled PDU]"
"100","13.062696","192.168.1.3","192.168.1.4","TCP","60","xmpp-client > 63822 [ACK] Seq=1021 Ack=256 Win=14268 Len=0"
"101","13.065384","192.168.1.3","192.168.1.2","TCP","343","[TCP segment of a reassembled PDU]"
"181","20.702748","192.168.1.3","192.168.1.2","TCP","66","xmpp-client > 54845 [ACK] Seq=278 Ack=1215 Win=32817 Len=0 TSval=848250 TSecr=1077716895"
"183","20.703002","192.168.1.3","192.168.1.2","TCP","66","xmpp-client > 54845 [ACK] Seq=278 Ack=1412 Win=32817 Len=0 TSval=848250 TSecr=1077716895"
"184","20.704991","192.168.1.3","192.168.1.4","TCP","267","[TCP segment of a reassembled PDU]"
"188","20.763281","192.168.1.3","192.168.1.4","TCP","253","[TCP segment of a reassembled PDU]"
"596","62.851422","192.168.1.3","192.168.1.2","TCP","66","xmpp-client > 54845 [ACK] Seq=278 Ack=1545 Win=32817 Len=0 TSval=858787 TSecr=1077759022"
"597","62.853260","192.168.1.3","192.168.1.2","TCP","215","[TCP segment of a reassembled PDU]"
"603","63.535878","192.168.1.3","192.168.1.4","TCP","60","xmpp-client > 63822 [ACK] Seq=1433 Ack=278 Win=14268 Len=0"
