"No.","Time","Source","Destination","Protocol","Length","Info"
"2","0.000270","192.168.1.3","192.168.1.2","TCP","66","xmpp-client > 54845 [ACK] Seq=1 Ack=198 Win=32817 Len=0 TSval=998401 TSecr=1078317148"
"3","0.002327","192.168.1.3","192.168.1.4","TCP","256","[TCP segment of a reassembled PDU]"
"8","0.079639","192.168.1.3","192.168.1.2","TCP","66","xmpp-client > 54845 [ACK] Seq=1 Ack=411 Win=32817 Len=0 TSval=998421 TSecr=1078317227"
"10","0.079962","192.168.1.3","192.168.1.2","TCP","66","xmpp-client > 54845 [ACK] Seq=1 Ack=608 Win=32817 Len=0 TSval=998421 TSecr=1078317227"
"11","0.081816","192.168.1.3","192.168.1.4","TCP","267","[TCP segment of a reassembled PDU]"
"15","0.151283","192.168.1.3","192.168.1.4","TCP","253","[TCP segment of a reassembled PDU]"
"19","0.192568","192.168.1.3","192.168.1.4","TCP","60","xmpp-client > 63822 [ACK] Seq=615 Ack=229 Win=23112 Len=0"
"20","0.194929","192.168.1.3","192.168.1.2","TCP","327","[TCP segment of a reassembled PDU]"
"24","0.264529","192.168.1.3","192.168.1.2","TCP","66","xmpp-client > 54845 [ACK] Seq=262 Ack=805 Win=32817 Len=0 TSval=998467 TSecr=1078317409"
"25","0.266650","192.168.1.3","192.168.1.4","TCP","256","[TCP segment of a reassembled PDU]"
"28","0.318259","192.168.1.3","192.168.1.2","TCP","66","xmpp-client > 54845 [ACK] Seq=262 Ack=1018 Win=32817 Len=0 TSval=998481 TSecr=1078317462"
"30","0.318525","192.168.1.3","192.168.1.2","TCP","66","xmpp-client > 54845 [ACK] Seq=262 Ack=1215 Win=32817 Len=0 TSval=998481 TSecr=1078317462"
"33","0.328926","192.168.1.3","192.168.1.4","TCP","466","[TCP segment of a reassembled PDU]"
"34","0.330981","192.168.1.3","192.168.1.2","TCP","327","[TCP segment of a reassembled PDU]"
"40","0.417728","192.168.1.3","192.168.1.4","TCP","256","[TCP segment of a reassembled PDU]"
"42","0.453456","192.168.1.3","192.168.1.2","TCP","66","xmpp-client > 54845 [ACK] Seq=523 Ack=1412 Win=32817 Len=0 TSval=998515 TSecr=1078317558"
"46","0.526701","192.168.1.3","192.168.1.2","TCP","66","xmpp-client > 54845 [ACK] Seq=523 Ack=1625 Win=32817 Len=0 TSval=998533 TSecr=1078317668"
"48","0.527020","192.168.1.3","192.168.1.2","TCP","66","xmpp-client > 54845 [ACK] Seq=523 Ack=1822 Win=32817 Len=0 TSval=998533 TSecr=1078317668"
"49","0.528955","192.168.1.3","192.168.1.4","TCP","267","[TCP segment of a reassembled PDU]"
"52","0.582310","192.168.1.3","192.168.1.2","TCP","66","xmpp-client > 54845 [ACK] Seq=523 Ack=2019 Win=32817 Len=0 TSval=998547 TSecr=1078317723"
"55","0.589607","192.168.1.3","192.168.1.4","TCP","455","[TCP segment of a reassembled PDU]"
"61","2.422932","192.168.1.3","192.168.1.2","TCP","327","[TCP segment of a reassembled PDU]"
"63","2.457582","192.168.1.3","192.168.1.4","TCP","60","xmpp-client > 63822 [ACK] Seq=2045 Ack=683 Win=23648 Len=0"
