"No.","Time","Source","Destination","Protocol","Length","Info"
"3","0.003822","192.168.1.2","192.168.1.4","TCP","60","xmpp-client > 51952 [ACK] Seq=1 Ack=231 Win=15608 Len=0"
"4","0.006436","192.168.1.2","192.168.1.3","TCP","343","[TCP segment of a reassembled PDU]"
"8","1.157852","192.168.1.2","192.168.1.4","TCP","277","[TCP segment of a reassembled PDU]"
"10","1.193713","192.168.1.2","192.168.1.3","TCP","66","xmpp-client > 60252 [ACK] Seq=278 Ack=214 Win=32817 Len=0 TSval=993012 TSecr=109482116"
"12","1.194030","192.168.1.2","192.168.1.3","TCP","66","xmpp-client > 60252 [ACK] Seq=278 Ack=411 Win=32817 Len=0 TSval=993012 TSecr=109482154"
"15","1.216687","192.168.1.2","192.168.1.4","TCP","253","[TCP segment of a reassembled PDU]"
