"No.","Time","Source","Destination","Protocol","Length","Info"
"4","0.117376","192.168.1.3","192.168.1.4","TCP","60","xmpp-client > 63822 [ACK] Seq=1 Ack=228 Win=15340 Len=0"
"5","0.119829","192.168.1.3","192.168.1.2","TCP","327","[TCP segment of a reassembled PDU]"
"10","0.220181","192.168.1.3","192.168.1.4","TCP","60","xmpp-client > 63822 [ACK] Seq=1 Ack=455 Win=15608 Len=0"
"11","0.222528","192.168.1.3","192.168.1.2","TCP","327","[TCP segment of a reassembled PDU]"
"16","0.343933","192.168.1.3","192.168.1.4","TCP","60","xmpp-client > 63822 [ACK] Seq=1 Ack=682 Win=15876 Len=0"
"17","0.346187","192.168.1.3","192.168.1.2","TCP","327","[TCP segment of a reassembled PDU]"
"22","0.468107","192.168.1.3","192.168.1.4","TCP","60","xmpp-client > 63822 [ACK] Seq=1 Ack=909 Win=16144 Len=0"
"23","0.470378","192.168.1.3","192.168.1.2","TCP","327","[TCP segment of a reassembled PDU]"
"28","0.585106","192.168.1.3","192.168.1.4","TCP","60","xmpp-client > 63822 [ACK] Seq=1 Ack=1136 Win=16412 Len=0"
"29","0.587389","192.168.1.3","192.168.1.2","TCP","327","[TCP segment of a reassembled PDU]"
"34","0.709128","192.168.1.3","192.168.1.4","TCP","60","xmpp-client > 63822 [ACK] Seq=1 Ack=1363 Win=16680 Len=0"
"35","0.711512","192.168.1.3","192.168.1.2","TCP","327","[TCP segment of a reassembled PDU]"
"40","0.823549","192.168.1.3","192.168.1.4","TCP","60","xmpp-client > 63822 [ACK] Seq=1 Ack=1590 Win=16948 Len=0"
"41","0.825761","192.168.1.3","192.168.1.2","TCP","327","[TCP segment of a reassembled PDU]"
